word,article,english,example
Respekt,der,respect,Der Respekt passt gut zu diesem Thema.
Rest,der,rest; remainder,Hier sind 100 Euro. Den Rest gebe ich dir später.
Restaurant,das,restaurant,Wir essen heute im Restaurant.
retten,,to save; to rescue,Der Arzt konnte das Kind noch retten.
Rezept,das,prescription; recipe,Diese Schmerztabletten gibt es nur auf Rezept.
Rezeption/Reception,die,reception,Geben Sie bitte den Schlüssel an der Rezeption ab.
Richter,der,judge,Der Richter hat noch kein Urteil gesprochen.
richtig,,correct; right,"Was Sie da sagen, ist richtig."
Richtung,die,direction,Der Zug in Richtung Köln hat Verspätung.
riechen,,to smell,Dieses Parfüm riecht sehr gut.
riesig,,huge; enormous,Die Stadt ist riesig.
Rind,das,cattle; beef,Ich esse nur Fleisch vom Rind.
Ring,der,ring,Ich habe meinen Ring verloren.
Risiko,das,risk,Ich nehme keinen Kredit auf. Das Risiko ist mir zu hoch.
Rock,der,skirt,Diese Bluse passt nicht zu meinem Rock.
roh,,raw,Du kannst das nicht essen. Das Fleisch ist noch roh.
Rohr,das,oven; pipe,Ich habe gerade eine Pizza gemacht. Sie ist ganz frisch aus dem Rohr.
Rolle,die,role; roll,Die Schauspielerin hat ihre Rolle sehr gut gespielt.
Roman,der,novel,Ich lese gern Romane.
Rose,die,rose,Rote Rosen sind ein schönes Geschenk.
Rucksack,der,backpack,Ich brauche nicht viel. Ich nehme nur meinen Rucksack mit.
Rückfahrt,die,return; back,Auf der Rückfahrt besuche ich meine Eltern.
Rückkehr,die,return,Nach meiner Rückkehr haben wir ein großes Fest gefeiert.
rückwärts,,backward,Ich bin rückwärts aus der Garage gefahren.
Rücken,der,back,Mir tut der Rücken weh.
rufen,,to call; to shout,"Ich habe die Kinder gerufen, aber sie haben mich nicht gehört."
Rufnummer,die,phone number,Wir möchten Sie gerne anrufen. Wie ist Ihre Rufnummer?
Ruhe,die,quiet; rest,Die Ruhe steht auf meiner Liste.
ruhig,,quiet; calm,Ich suche ein ruhiges Zimmer.
rund,,round,Wir haben für unser Wohnzimmer einen runden Tisch gekauft.
Runde,die,round; lap,Ich laufe jeden Tag fünf Runden im Park.
Rundfahrt,die,tour; sightseeing trip,Am zweiten Tag haben wir eine Rundfahrt durch den Hafen gemacht.
Saal,der,hall,Für unsere Familienfeier haben wir einen kleinen Saal gemietet.
Sache,die,thing; matter,Wir haben unsere Sachen im Hotel gelassen.
Sack,der,sack; bag,Ich hätte gern einen Sack Kartoffeln.
Saft,der,juice,Ich trinke gern Apfelsaft.
sagen,,to say,Entschuldigung! Was haben Sie gesagt?
Saison,die,season,Urlaub in den Schulferien ist immer teurer. Das ist die Saison mit den höchsten Preisen.
Salat,der,salad,Möchten Sie zum Fisch einen Salat?
Salbe,die,ointment,Diese Salbe gibt es nur auf Rezept.
Salon,der,salon,Sie arbeitet als Friseurin in einem Salon.
Salz,das,salt,Gib mir bitte mal das Salz!
salzig,,salty,Das Wort 'salzig' ist nützlich.
sammeln,,to collect,Mein Bruder sammelt Briefmarken.
sämtliche,,all; every single,Sämtliche Fenster müssen geschlossen bleiben.
Sand,der,sand,Der Sand passt gut zu diesem Thema.
Sänger,der,singer,Wie findest du diesen Sänger? − Ich finde seine Stimme toll.
satt,,full; satisfied,"Möchten Sie noch etwas? – Nein danke, ich bin satt."
Satz,der,sentence,Den letzten Satz verstehe ich nicht.
sauber,,clean,Bringen Sie mir bitte ein sauberes Glas!
sauer,,sour; angry,Die Äpfel sind mir zu sauer.
Schachtel,die,box; packet,Ich hätte gern eine Schachtel Zigaretten.
schade,,too bad; pity,Ich kann leider nicht mitkommen. – Das ist aber schade!
schaden,,to harm,Ein kleines Glas Wein kann nicht schaden.
Schaden,der,damage,Ich hatte einen Unfall mit dem Auto. Jetzt muss ich den Schaden der Versicherung melden.
schaffen,,to manage; to create,"Kannst du mir helfen, die Party vorzubereiten? Ich schaffe das nicht allein."
schalten,,to switch,"Schalten Sie bitte das Licht aus, wenn Sie gehen."
Schalter,der,switch; counter,Der Lichtschalter ist rechts neben der Tür.
Schatten,der,shadow; shade,Im Schatten ist es angenehm kühl.
schauen,,to look,Schau mal! Da vorne ist noch ein Platz frei.
zuschauen,,to watch,"Willst du mitspielen? – Nein, ich schaue lieber nur zu."
Schaufenster,das,shop window,Ich habe im Schaufenster eine schicke Bluse gesehen.
Scheibe,die,slice; pane,"Fünf Scheiben Käse, bitte."
sich scheiden lassen,,to get divorced,Ich übe das reflexive Verb 'scheiden lassen'.
sich scheiden,,to divorce; to separate,Ich übe das reflexive Verb 'scheiden'.
scheiden,,to separate; to divorce,Dieses Verb heißt 'scheiden'.
Scheidung,die,divorce,Wann war die Scheidung?
Schein,der,bill; note; certificate,Kannst du einen Schein in Kleingeld wechseln?
scheinen,,to shine; to seem,Gestern hat es geregnet. Heute scheint wieder die Sonne.
schenken,,to give as a gift,Wir wollen dir zum Geburtstag etwas schenken.
Schere,die,scissors,Die Schere hier schneidet schlecht. Hast du noch eine andere?
schicken,,to send,Ich habe meinen Freunden eine Einladung zur Hochzeit geschickt.
schieben,,to push,Leider ist mein Fahrrad kaputtgegangen. Ich musste es nach Hause schieben.
schief,,crooked; slanted,Der Spiegel hängt ganz schief.
schießen,,to shoot,Unsere Mannschaft hat ein Tor geschossen.
Schiff,das,ship,Sind Sie mit dem Schiff oder mit dem Flugzeug gekommen?
Schild,das,sign; shield,"Kannst du lesen, was dort auf dem Schild steht?"
schimpfen,,to scold,"Der Arzt hat mit mir geschimpft, weil ich zu wenig Sport mache."
Schinken,der,ham,"Bitte, ein Brötchen mit Schinken."
schlafen,,to sleep,Haben Sie gut geschlafen?
Schlaf,der,sleep,Das Kind macht jeden Tag nach dem Mittagessen einen kurzen Schlaf.
schlagen,,to hit; to beat,Wer hat den Weltmeister geschlagen?
Obers,der,cream; whipped cream,Ich hätte gern ein Stück Torte mit Schlagobers.
Schlange,die,snake; line; queue,Auf der Post gibt es immer eine lange (Warte-)Schlange.
schlank,,slim,In diesem Kleid siehst du sehr schlank aus.
schlecht,,bad; poor,Das Wetter ist schlecht.
schließen,,to close,"Bitte, schließen Sie die Tür."
schließlich,,finally; after all,Ich musste lange warten. Aber schließlich habe ich den Job doch noch bekommen.
schlimm,,bad; serious,Die Wunde sieht schlimm aus.
Schloss,das,lock; castle,An unserer Wohnungstür ist das Schloss kaputt.
Schluss,der,end; conclusion,Ich muss jetzt Schluss machen. Es klingelt an der Tür.
Schlüssel,der,key,Ich kann meine Schlüssel nicht finden.
schmecken,,to taste,Hat es Ihnen geschmeckt?
Schmerz,der,pain,Haben Sie Schmerzen?
Schmerzmittel,das,painkiller,Sie haben Zahnschmerzen? Ich verschreibe Ihnen ein Schmerzmittel.
Schmuck,der,jewelry,Dieser Schmuck ist von meiner Großmutter.
Schmutz,der,dirt,Du hast Schmutz an deinen Schuhen.
schmutzig,,dirty,Das Wort 'schmutzig' ist nützlich.
verschmutzen,,to pollute,Ich wiederhole heute 'verschmutzen'.
Schnee,der,snow,Im Februar gibt es oft viel Schnee.
schneien,,to snow,Heute Nacht hat es geschneit.
schneiden,,to cut,Das Messer schneidet nicht.
schnell,,fast; quick,Warum fährst du so schnell?
Schnitzel,das,schnitzel,Bitte ein Schnitzel mit Kartoffeln und Salat.
Schokolade,die,chocolate,Ich habe eine Tafel Schokolade gegessen.
schon,,already,Ist das Essen schon fertig?
schön,,beautiful; nice,Ich finde eure Wohnung sehr schön.
Schrank,der,cabinet; wardrobe,Die Handtücher liegen im Schrank.
Schreck,der,fright; shock,Ich habe einen großen Schreck bekommen.
schrecklich,,terrible; awful,Heute ist eine schreckliche Hitze.
schreiben,,to write,Ich habe dir einen Brief geschrieben.
aufschreiben,,to write down,Ich habe mir deine Telefonnummer aufgeschrieben.
Schreiben,das,letter; writing,Das Schreiben steht auf meiner Liste.
Schrift,die,handwriting; script,Ich kann leider deine Schrift nicht lesen.
schriftlich,,written; in writing,'schriftlich' kommt in vielen Texten vor.
Schriftsteller,der,writer; author,Der Schriftsteller passt gut zu diesem Thema.
Schritt,der,step,Der Schritt ist heute wichtig.
Schuh,der,shoe,Die neuen Schuhe sind mir zu eng.
Schuld,die,fault; blame,"Es ist nicht meine Schuld, dass das nicht geklappt hat."
schuld,,guilty; at fault,Dieses Wort heißt 'schuld'.
Schulden,die,debts,Die Schulden passt gut zu diesem Thema.
schuldig,,guilty,Ich übe das Wort 'schuldig'.
Schule,die,school,Meine Tochter geht schon in die Schule.
Schüler,der,student; pupil,Der Schüler kommt in der Prüfung vor.
Schulter,die,shoulder,Ich habe Schmerzen in der rechten Schulter.
Schüssel,die,bowl,Gibst du mir bitte eine Schüssel für den Salat?
schütteln,,to shake,Die Flasche muss man vor dem Öffnen schütteln.
schützen,,to protect,Diese Impfung schützt vor Grippe.
Schutz,der,protection,Das ist ein guter Schutz gegen Kälte.
schwach,,weak,Ich bin noch nicht gesund. Ich fühle mich noch sehr schwach.
Schwammerl,das,mushroom,Haben Sie frische Schwammerln?
schwanger,,pregnant,Meine Frau ist im dritten Monat schwanger.
Schwangerschaft,die,pregnancy,Sie dürfen während der Schwangerschaft nicht rauchen.
schweigen,,to be silent,"Sie sprach viel, aber ihr Mann schwieg den ganzen Abend lang."
schwer,,heavy; difficult,Der Koffer ist viel zu schwer.
Schwester,die,sister; nurse,Ich habe eine ältere Schwester und einen jüngeren Bruder.
Schwierigkeit,die,difficulty,Ich hatte große Schwierigkeiten einen Parkplatz zu bekommen.
schwimmen,,to swim,Ich gehe regelmäßig schwimmen.
Schwimmbad,das,swimming pool,Kommst du mit ins Schwimmbad?
schwitzen,,to sweat,Es war sehr heiß. Wir haben alle sehr geschwitzt.
See,der,lake,Unser Hotel war direkt am See.
See,die,sea,Die See ist heute wichtig.
Nord-/Ostsee,die,North Sea; Baltic Sea,Die Nordsee und die Ostsee sind Meere.
sehen,,to see,Ich sehe nicht gut. Ich brauche eine Brille.
Sehenswürdigkeit,die,sight; attraction,Welche Sehenswürdigkeiten gibt es hier?
sehr,,very,Ich habe mich sehr über Ihren Besuch gefreut.
Seife,die,soap,Hier gibt es keine Seife.
sein,,to be,Ich bin Mechaniker.
seit,,since,Wir wohnen seit dem März in Dortmund.
seitdem,,since then,Dieses Wort heißt 'seitdem'.
Seite,die,side; page,Das hier ist die Goethestraße. Ich wohne auf der linken Seite.
Sekretär,der,secretary,Der Sekretär ist heute wichtig.
Sekretärin,die,female secretary,Die Sekretärin steht auf meiner Liste.
selbe,,same,Ich habe am selben Tag Geburtstag wie du.
selber,,oneself; yourself,Dieses Wort heißt 'selber'.
selbstständig,,self-employed; independent,Jetzt bin ich angestellt. Früher war ich selbstständig.
selbstverständlich,,of course; naturally,Ich übe das Wort 'selbstverständlich'.
selten,,rare; seldom,Ich gehe ganz selten ins Kino.
seltsam,,strange; odd,"Es ist seltsam, dass mein Bruder noch nicht hier ist."
Semester,das,semester,Mein Neffe studiert im ersten Semester Medizin.
Semmel,die,bread roll,D: Ich hole schnell ein paar Semmeln zum Frühstück.
senden,,to send,Bitte senden Sie uns die Unterlagen per E-Mail.
gesendet/gesandt,,sent; forwarded,Können Sie uns die Post bitte nachsenden?
Sender,der,TV/radio station; sender,Welchen Sender siehst du am liebsten?
Senioren,die,senior citizens,Dieser Computerkurs ist für Senioren.
senkrecht,,vertical,Ziehen Sie bitte eine senkrechte Linie.
Serie,die,series,"Meine Tochter liebt es, im Fernsehen Serien zu schauen."
Service,der,service,Rufst du beim Pizza-Service an?
Serviceangestellte,der,service employee; waiter,Der Serviceangestellte kommt in der Prüfung vor.
Ober,der,waiter,Ich bin Ober von Beruf.
Sessel,der,armchair,"A, Ich hätte gern einen bequemen Sessel."
sicher,,safe; secure; sure,Dieses Auto ist besonders sicher.
Sicherheit,die,safety; security,Sicherheit ist für mich sehr wichtig.
sichern,,to save; to secure,Du musst immer alle Daten im Computer sichern.
sichtbar,,visible,Es gibt keine sichtbaren Verletzungen. Aber wir müssen das Bein trotzdem untersuchen.
siegen,,to win; to be victorious,Die Mannschaft siegte mit 2:0.
Sieg,der,victory,Der Sieg ist heute wichtig.
Sieger,der,winner,Der Sieger steht auf meiner Liste.
singen,,to sing,Ich wiederhole heute 'singen'.
gesungen,,sung,"Ich kann heute nicht singen, ich bin erkältet."
sinken,,to sink,Das Schiff ist vor der Küste gesunken.
Sinn,der,sense; meaning,Der Sinn ist heute wichtig.
sinnlos,,senseless; pointless,Das Wort 'sinnlos' ist nützlich.
sinnvoll,,sensible; meaningful,Ich wiederhole heute 'sinnvoll'.
Situation,die,situation,Ich bin in einer schwierigen Situation.
sitzen,,to sit,Dieses Verb heißt 'sitzen'.
gesessen,,sat; been sitting,Ich habe hinten gesessen.
Sitz,der,seat,Der Sitz steht auf meiner Liste.
Ski/Schi,der,ski,Gehen wir am Wochenende Ski laufen?
sobald,,as soon as,"Sobald ich den Termin weiß, gebe ich Ihnen Bescheid."
Socke,die,sock,Im Winter brauche ich warme Socken.
sodass,,so that,"Der Zug hatte zwei Stunden Verspätung, sodass ich erst um 23 Uhr nach Hause kam."
Sofa,das,sofa,Wir hätten gern ein modernes Sofa.
sofort,,immediately,Warum sind Sie nicht sofort zum Arzt gegangen?
sogenannt,,so-called,"Studenten, die lange studieren, sind sogenannte Langzeitstudierende."
Sohn,der,son,Mein jüngster Sohn ist vier.
solange,,as long as,"Solange Sie Fieber haben, dürfen Sie auf keinen Fall arbeiten gehen."
sollen,,should; to be supposed to,Wann soll ich kommen?
Sonderangebot,das,special offer,Das ist ein Sonderangebot: 25 % reduziert.
sondern,,but rather,"Unser Besuch kommt nicht heute, sondern morgen."
Sonne,die,sun,Das Wetter ist schön. Die Sonne scheint.
sonnig,,sunny,Das Wetter morgen: sonnig und warm.
sonst,,otherwise; else,"Haben sie sonst noch einen Wunsch? – Nein, danke. Das ist alles."
sorgen,,to care for; to worry,Wer sorgt denn für die Kinder?
Sorge,die,worry; concern,Um Ihre Zukunft brauchen Sie sich keine Sorgen zu machen.
Soße/Sauce,die,sauce,Gibst du mir bitte mal die Soße?
Souvenir,das,souvenir,Ich habe ein paar Souvenirs aus dem Urlaub mitgebracht.
soviel,,as far as; as much as,"Soviel ich weiß, hat dieses Restaurant heute Ruhetag."
so viel/so viel wie,,so much; as much as,Ich habe so viel gegessen. Jetzt ist mir schlecht.
sowieso,,anyway,Willst du mir den Brief mitgeben? Ich gehe sowieso zur Post.
sowohl … als auch,,both ... and ...,Sowohl Sie als auch Ihre Frau müssen unterschreiben.
sozial,,social,Das System ist nicht sozial.
Sozialarbeiter,der,social worker,Die Sozialarbeiterin kommt einmal in der Woche.
spannend,,exciting,Das Spiel war spannend bis zur letzten Minute.
sparen,,to save; to economize,'sparen' kommt in vielen Texten vor.
gespart,,saved,"Um Strom zu sparen, schalten wir die Heizung nachts aus."
sparsam,,economical; frugal,Ich übe das Wort 'sparsam'.
Spaß,der,fun,Meine Arbeit macht mir viel Spaß.
spät,,late,'spät' kommt in vielen Texten vor.
spätestens,,at the latest,Dieses Wort heißt 'spätestens'.
spazieren gehen,,to go for a walk,Wir gehen sonntags immer spazieren.
spazieren,,to stroll; to walk,Ich übe das Verb 'spazieren'.
Spaziergang,der,walk; stroll,Abends mache ich oft einen Spaziergang durch das Viertel.
speichern,,to save; to store,Ich wiederhole heute 'speichern'.
Speisekarte,die,menu,"Bitte, die Speisekarte."
Speisewagen,der,dining car,Der Speisewagen passt gut zu diesem Thema.
Spezialistin,die,specialist,Die Spezialistin ist heute wichtig.
speziell,,special; specific,Ich suche einen ganz speziellen Ring für meine Freundin.
Spiegel,der,mirror,Im Bad hängt ein großer Spiegel.
Spiel,das,game,Monopoly ist ein ganz bekanntes Spiel.
Spieler,der,player,Für dieses Spiel braucht man zwei bis vier Spieler.
Spielplatz,der,playground,Die Kinder sind auf dem Spielplatz.
Spielzeug,das,toy,Zu Weihnachten wünschen sich die Kinder vor allem Spielzeug.
spitz,,sharp; pointed,Der Bleistift ist nicht spitz.
Sport,der,sport; sports,Für Sport interessiere ich mich sehr.
Sportart,die,type of sport,Welche Sportart findest du am besten?
Sportler,der,athlete,Sie ist eine gute Sportlerin.
sportlich,,athletic; sporty,Ich bin nicht sehr sportlich.
Sprache,die,language,Franco spricht mehrere Sprachen.
Fremdsprache,die,foreign language,Ich spreche drei Fremdsprachen.
Muttersprache,die,native language,Was ist Ihre Muttersprache?
Zweitsprache,die,second language,Deutsch ist seine Zweitsprache.
sprechen,,to speak,Können Sie bitte etwas lauter sprechen?
Sprechstunde,die,office hours; consultation hours,Frau Dr. Berger hat von 8 bis 12 Uhr Sprechstunde.
springen,,to jump,Wir waren im Schwimmbad. Mein Sohn ist immer wieder ins Wasser gesprungen.
Spritze,die,injection; syringe,Ich habe heute vom Arzt eine Spritze gegen die Schmerzen bekommen.
spülen,,to rinse; to wash dishes,Hast du das Geschirr gespült?
Spur,die,lane; track; trace,"Fahren Sie bitte auf der linken Spur, wenn Sie schneller fahren."
spüren,,to feel; to sense,Wo tut es weh? Spüren Sie das hier?
Stadion,das,stadium,Ich möchte am Samstag ins Stadion gehen. Da spielt meine Mannschaft.
Stadt,die,city; town,Heidelberg ist eine alte Stadt.
städtisch,,urban; municipal,Ich übe das Wort 'städtisch'.
Stadtplan,der,city map,Haben Sie einen Stadtplan?
stammen,,to come from; to originate,Ich wiederhole heute 'stammen'.
ständig,,constant; constantly,Ich habe schon ein paar Mal bei meiner Freundin angerufen. Es ist ständig besetzt.
Standpunkt,der,point of view; standpoint,Von seinem Standpunkt aus hat er recht.
Star,der,star,Diese Sängerin ist ein großer Star in Deutschland.
stark,,strong,Der Kaffee ist sehr stark.
starten,,to start,Das Flugzeug ist pünktlich gestartet.
Start,der,start,Bleiben Sie bitte während des Starts sitzen.
Station,die,station; stop,Sie müssen an der nächsten Station aussteigen.
Statistik,die,statistics,"Die Statistik zeigt, dass jeder zweite ein Fahrrad besitzt."
statistisch,,statistical,Die statistischen Ergebnisse zeigen eine gute Entwicklung.
statt,,instead of,Kann ich diese Woche statt Donnerstag am Freitag kommen?
stattfinden,,to take place,Das Spiel findet auch bei Regen statt.
Stau,der,traffic jam,Auf der A3 gibt es wegen eines Unfalls 5 km Stau.
Staub,der,dust,Ich habe überall Staub gewischt.
staubsaugen,,to vacuum,Ich muss heute in meiner Wohnung noch staubsaugen.
stechen,,to sting; to prick,Stefan wird beim Zelten immer von den Mücken gestochen.
stecken,,to be stuck; to put,Wo ist denn mein Pass? Ich hatte ihn doch in die Handtasche gesteckt.
Steckdose,die,socket; outlet,Es gibt drei Steckdosen in diesem Zimmer.
Stecker,der,plug,Der Stecker passt nicht in die Steckdose.
stehen bleiben,,to stop; to remain standing,Bitte bleiben Sie stehen.
stehlen,,to steal,Gestern hat mir jemand im Zug meine Uhr gestohlen.
steigen,,to rise; to climb,Die Preise für Milch und Gemüse sind schon wieder gestiegen.
steil,,steep,Die Straße zu unserem Haus ist sehr steil.
Stein,der,stone,Die Kinder werfen Steine ins Wasser.
Stelle,die,place; position; job,Wir treffen uns hier an dieser Stelle.
stellen,,to put; to place,Stell das Bier in den Kühlschrank!
Stempel,der,stamp,Der Stempel ist ein nützliches Wort.
gestorben,,died,Vater ist gestern gestorben.
Stern,der,star,Heute sieht man viele Sterne am Himmel.
Steuer,die,tax; steering wheel,Wir müssen immer mehr Steuern zahlen.
Steward,der,flight attendant; steward,Der Steward bringt das Mittagessen.
Stewardess,die,flight attendant; stewardess,Die Stewardess ist ein nützliches Wort.
Stift,der,pen,Kannst du mir bitte einen Stift geben?
Stil,der,style,Ihr Stil ist sehr elegant.
stilistisch,,stylistic,Das Wort 'stilistisch' ist nützlich.
still,,silent; still,Sei doch mal einen Moment still!
Stiefel,der,boot,Im Winter trage ich warme Stiefel.
Stiege,die,stairs,Die Stiege passt gut zu diesem Thema.
Stiegenhaus,das,stairwell,Das Stiegenhaus ist heute wichtig.
Stimme,die,voice,Ich habe dich sofort an der Stimme erkannt.
stimmen,,to be correct; to vote,Meine Adresse stimmt nicht mehr.
Stimmung,die,mood; atmosphere,Es war eine tolle Party. Die Stimmung war sehr gut.
stinken,,to stink,Was stinkt denn hier so? – Das ist der Fisch. Er ist nicht mehr frisch.
Stock,der,floor; stick,Der Stock ist heute wichtig.
Stockwerk,das,floor; story,Das Gebäude hat zwanzig Stockwerke.
Stoff,der,fabric; material,Was für ein Stoff ist das? – Wolle.
stolz,,proud,Ich bin stolz auf dich. Das hast du sehr gut gemacht.
stoppen,,to stop,"Die Polizei hat mich gestoppt, weil ich bei Rot über die Ampel gefahren bin."
stören,,to disturb; to bother,Darf ich Sie einen Augenblick stören?
Störung,die,disturbance; disruption,Entschuldigen Sie bitte die Störung.
Strafe,die,fine; penalty,Schwarzfahren kostet 60 Euro Strafe.
strafbar,,punishable; illegal,"Was du da machst, ist strafbar."
Strafzettel,der,parking ticket; fine notice,So ein Pech! Ich habe einmal falsch geparkt und sofort einen Strafzettel bekommen.
Straße,die,street; road,Wir wohnen in einer sehr kleinen Straße.
Strecke,die,route; distance,Die Strecke steht auf meiner Liste.
Streichholz,das,match,Ich hätte gern eine Schachtel Streichhölzer.
streiken,,to strike,Die Arbeiter streiken für höhere Löhne.
Streik,der,strike,Der Streik passt gut zu diesem Thema.
Streit,der,argument; dispute,Der Streit ist heute wichtig.
streng,,strict,Unsere Tochter hat einen sehr strengen Lehrer.
Stress,der,stress,Ich habe bei der Arbeit viel Stress.
Strom,der,electricity; power,Wie kann ich im Haushalt Strom sparen?
Strumpf,der,stocking; sock,Wo sind meine roten Strümpfe?
Stück/-stück,das,piece,Ich nehme zwei Stück Zucker in den Kaffee.
Studie,die,study,Wir führen eine Studie über Arbeitslosigkeit durch.
studieren,,to study,Mein Sohn will Medizin studieren.
Student,der,student,Schüler und Studenten zahlen die Hälfte.
Studentin,die,female student,Die Studentin passt gut zu diesem Thema.
Studierende,der,student; learner,Der Studierende ist heute wichtig.
Studierende,die,students,Die Studierenden brauchen für diese Stelle ein abgeschlossenes Studium.
Studium,das,studies; degree program,Das Studium kommt in der Prüfung vor.
Studio,das,studio,Zu Gast im Studio sind heute...
Stufe,die,step; level,Die Stufe passt gut zu diesem Thema.
Stuhl,der,chair,Da hinten ist noch ein Stuhl frei.
stumm,,silent; muted,Stell bitte dein Handy leise oder auf stumm.
Stunde,die,hour; lesson,Ich bin in einer Stunde wieder zurück.
Sturm,der,storm,Im Radio haben sie Regen und Sturm angesagt.
stürzen,,to fall; to crash,Ich bin auf der Straße gestürzt und habe mir den Fuß gebrochen.
suchen,,to search; to look for,Ich suche meine Brille.
Sucht,die,addiction,Die Sucht nach Medikamenten nimmt zu.
süchtig,,addicted,Ich bin süchtig nach Schokolade.
Suchtmittel,das,addictive substance,Manche Medikamente sind auch Suchtmittel.
super,,super; great,Das war ein super Film!
Supermarkt,der,supermarket,Donnerstags gehe ich immer in den Supermarkt.
Suppe,die,soup,Schmeckt dir die Suppe?
süß,,sweet,Ich esse gern süße Sachen.
Symbol,das,symbol,Das Herz ist ein Symbol für die Liebe.
sympathisch,,likable; pleasant,Ich finde unsere neue Kollegin sehr sympathisch.
System,das,system,Welches Betriebssystem hast du?
Szene,die,scene,In dieser Szene des Films stirbt der Held.
Tabelle,die,table; chart,Tragen Sie die richtige Information in die Tabelle ein.
Tablette,die,tablet; pill,Nehmen Sie dreimal täglich eine Tablette.
Tafel,die,board; bar,Der Lehrer schreibt das neue Wort an die Tafel.
Tagesablauf,der,daily routine,Wie ist Ihr Tagesablauf?
Tal,das,valley,Unser Dorf liegt in einem Tal.
Talent,das,talent,Sie hat großes Talent für Musik.
tanken,,to refuel,Wir müssen unbedingt tanken. Wir haben fast kein Benzin mehr.
Tankstelle,die,gas station,Die Tankstelle passt gut zu diesem Thema.
Tante,die,aunt,"Die Familie meiner Mutter ist sehr groß, daher habe ich viele Tanten."
tanzen,,to dance,Auf der Hochzeit haben wir viel getanzt.
Tanz,der,dance,Der Tanz kommt in der Prüfung vor.
Tasche,die,bag; pocket,"Ich habe nicht viel Gepäck, nur eine Tasche."
Taschengeld,das,pocket money; allowance,Wie viel Taschengeld bekommst du im Monat?
Taschentuch,das,tissue; handkerchief,Hast du ein Taschentuch für mich?
Tasse,die,cup,Die Tassen sind von meiner Großmutter.
Tastatur,die,keyboard,Die Tastatur an meinem Computer ist ganz neu.
Taste,die,key; button,An der Fernbedienung ist eine Taste kaputt.
Tat,die,deed; act,Dieser Mensch hat mit vielen guten Taten geholfen.
Täter,der,perpetrator; offender,Der Täter ist heute wichtig.
Tätigkeit,die,activity; occupation,Die Tätigkeit steht auf meiner Liste.
Tatsache,die,fact,Das widerspricht den Tatsachen.
tatsächlich,,actually; indeed,"Die Hose ist tatsächlich zu klein, obwohl sie so groß aussieht."
taub,,deaf,"Sie hört schlecht, sie ist schon fast taub."
tauchen,,to dive,Ich möchte im Urlaub wieder tauchen gehen.
tauschen,,to exchange; to swap,Ich würde meinen Kuchen gegen dein Brot tauschen.
Technik,die,technology; technique,Ich verstehe nicht viel von Technik.
technisch,,technical,Es gab ein technisches Problem.
Technologie,die,technology,Große Fortschritte gab es in der Technologie.
Tee,der,tea,Bitte einen Tee mit Zitrone.
teilen,,to divide; to share,Mein Mann und ich teilen uns die Arbeit.
Teil,das,part; piece,Dieses Teil müssen wir erst bestellen.
Teil,der,part,Der Teil ist ein nützliches Wort.
Teilzeit,die,part-time,Ich arbeite im Moment nur Teilzeit.
teilnehmen,,to participate,Leider konnte ich an dem Kurs nicht regelmäßig teilnehmen.
Teilnahme,die,participation,Die Teilnahme am Gewinnspiel ist kostenlos.
Teilnehmer,der,participant,Die Teilnehmerinnen aus unserem Kurs kommen aus verschiedenen Ländern.
telefonieren,,to telephone; to call,Ich muss kurz telefonieren.
Telefon,das,telephone; phone,Das Telefon passt gut zu diesem Thema.
Teller,der,plate,Stell bitte schon mal die Teller auf den Tisch!
Tempo,das,speed; tempo,Hier darfst du nur Tempo 30 fahren.
Tennis,das,tennis,Ich spiele gern Tennis.
Teppich,der,carpet,Ich habe mir einen neuen Teppich gekauft.
