word,article,english,example
Mechaniker,der,mechanic,Das kann nur ein Mechaniker reparieren.
Medien,die,media,Umweltschutz ist in den Medien ein großes Thema.
Medikament,das,medication; medicine,Dieses Medikament gibt es nur auf Rezept.
Medizin,die,medicine,Du musst noch deine Medizin nehmen.
Meer,das,sea,Wir machen immer Urlaub am Meer.
Mehl,das,flour,Ich möchte einen Kuchen backen. Ist noch genug Mehl da?
mehr,,more,Ich habe diesmal mehr gelernt als bei der letzten Prüfung.
mehrere,,several,Ich kann 'mehrere' in einem Satz benutzen.
Mehrheit,die,majority,Die Mehrheit der Menschen in Deutschland besitzt ein Handy.
Mehrwertsteuer,die,value-added tax; VAT,Die Mehrwertsteuer bei diesem Produkt beträgt 20 %.
meinen,,to mean; to think,Dieser Film ist gut. Was meinst du?
meinetwegen,,as far as I am concerned,Meinetwegen kannst du heute das Auto haben.
Meinung,die,opinion,"Ich bin der Meinung, dass du recht hast."
meist,,most; mostly,Wie gut kannst du Deutsch? – Das Meiste verstehe ich.
Meister,der,master; foreman,"Ich weiß nicht, wie man das macht. – Dann frag doch den Meister."
Meldung,die,report; announcement,Hast du die Meldung im Radio gehört? Es wird starken Sturm geben.
Menge,die,amount; quantity,"Diesen Preis gibt es nur, wenn Sie große Mengen kaufen."
Mensa,die,cafeteria; dining hall,Ich esse fast jeden Tag in der Mensa.
Mensch,der,person; human being,Die Menschen sind hier ein bisschen anders als im Süden.
menschlich,,human; humane,Fehler zu machen ist menschlich.
Menü,das,menu,"Nimm doch das Menü, das sieht gut aus."
merken,,to notice; to remember,"Ich habe nicht gemerkt, dass es schon so spät ist. Ich muss gehen."
merkwürdig,,strange; odd,Das ist eine merkwürdige Geschichte.
Messe,die,fair; trade fair,Kommst du mit zur Automobilmesse?
messen,,to measure,Haben Sie schon Fieber gemessen?
Messer,das,knife,Das Messer schneidet nicht gut.
Methode,die,method,"Weißt du eine gute Methode, um schnell gut Deutsch zu lernen?"
Metropole,die,metropolis; major city,Berlin und Wien sind Metropolen.
mieten,,to rent,Wir haben die Wohnung für drei Jahre gemietet.
Miete,die,rent,Unsere Miete ist sehr hoch.
Mieter,der,tenant,Der Mieter passt gut zu diesem Thema.
Migrant,der,migrant,Der Migrant ist heute wichtig.
Migrantin,die,female migrant,Die Migrantin steht auf meiner Liste.
Migration,die,migration,Gestern gab es im Fernsehen eine Diskussion zum Thema Migration.
Milch,die,milk,Stellst du bitte die Milch in den Kühlschrank?
mild,,mild,"Möchten Sie die Soße scharf? – Nein, bitte ganz mild."
Minderheit,die,minority,Frauen sind in unserer Firma in der Minderheit.
mindestens,,at least,Ein guter Fernsehapparat kostet mindestens 500 Euro.
Mineralwasser,das,mineral water,Kann ich bitte ein Mineralwasser haben?
minimal,,minimal,Da ist nur ein minimaler Unterschied.
mischen,,to mix,Ich möchte ein gemischtes Eis mit Sahne.
Misserfolg,der,failure,Die Konferenz war ein Misserfolg.
mit,,with,Ich gehe heute Abend mit Maria aus.
Mitarbeiter,der,employee; staff member,Unsere Firma hat sieben Mitarbeiter.
miteinander,,with each other; together,Sprechen Sie bitte miteinander.
Mitglied,das,member,Für Mitglieder ist der Eintritt zum Konzert gratis.
Mitte,die,middle; center,Wo möchten Sie sitzen? – In der Mitte.
mitteilen,,to inform; to communicate,Den Prüfungstermin teilen wir Ihnen noch mit.
Mittel,das,remedy; means,Haben Sie ein Mittel gegen Magenschmerzen?
mittler-,,middle,In den mittleren Reihen sind noch Plätze frei.
Möbel,das,furniture,Wir haben uns neue Möbel gekauft. Ich suche ein möbliertes Zimmer.
möchten,,would like,Möchtest du auch einen Kaffee?
mobil,,mobile,Mit dem Fahrrad bin ich in der Stadt sehr mobil.
Mobilität,die,mobility,Sprachen zu lernen fördert die Mobilität.
Mobiltelefon,das,mobile phone,Wie findest du das neue Mobiltelefon?
Mode,die,fashion,Die Mode passt gut zu diesem Thema.
Modell,das,model,Wie findest du dieses Auto? – Dieses Modell gefällt mir nicht.
modern,,modern,Die Wohnung ist modern eingerichtet.
mögen,,to like,Ich mag keinen Reis.
möglich,,possible,Kann ich bitte sofort einen Termin haben? – Das ist leider nicht möglich.
Möglichkeit,die,possibility; opportunity,Diese Möglichkeit passt gut zu diesem Thema.
möglichst,,as ... as possible,Das Wort 'möglichst' ist im Alltag nützlich.
Moment,der,moment,Warten Sie bitte einen Moment.
Mond,der,moon,Bei Vollmond kann ich nicht schlafen.
Monitor,der,monitor,Ich habe mir einen größeren Monitor gekauft. Das ist besser für meine Augen.
Motor,der,engine; motor,Der Motor ist kaputt. Das Auto fährt nicht mehr.
Motorrad,das,motorcycle,Oskar fährt jeden Tag mit dem Motorrad zur Arbeit.
müde,,tired,Ich bin müde. Ich gehe schlafen.
Mühe,die,effort; trouble,Vielen Dank für Ihre Mühe.
Müll,der,trash; garbage,Bringst du bitte noch den Müllsack raus?
Müllabfuhr,die,garbage collection,Die Müllabfuhr passt gut zu diesem Thema.
Mülltonne,die,trash bin; garbage can,Die Mülltonne ist voll.
Mund,der,mouth,Sie haben Halsschmerzen? Bitte machen Sie mal den Mund auf.
mündlich,,oral; spoken,Die mündliche Prüfung ist erst nächste Woche.
Münze,die,coin,Der Automat nimmt nur Münzen.
Museum,das,museum,Wir waren mit unserer Klasse im Museum.
Musik,die,music,Wie findest du die Musik?
musikalisch,,musical,"Sie ist sehr musikalisch: Sie spielt Klavier, Flöte und Geige."
Musiker,der,musician,Mein Bruder möchte Musiker werden.
Muskel,der,muscle,Im Fitness-Studio trainieren wir unsere Muskeln.
nach,,after; to; according to,Ich fahre nach Berlin.
Nachbar,der,neighbor,Meine neue Nachbarin ist sehr nett.
Nachbarin,die,female neighbor,Die Nachbarin steht auf meiner Liste.
Müesli/Müsli,das,muesli; granola,Zum Frühstück esse ich Müsli.
Mut,der,courage,"Man braucht viel Mut, um in einem fremden Land ganz neu anzufangen."
mutig,,brave; courageous,"Es war sehr mutig von dir, deine Meinung laut zu sagen."
Mutter,die,mother,Meine Mutter heißt Klara.
nachdem,,after; after that,"Nachdem wir gegessen hatten, sind wir spazieren gegangen."
nachdenken,,to think about; to reflect,"Ich weiß nicht, was ich machen soll. Ich muss nachdenken."
Nachfrage,die,demand; inquiry,Die Nachfrage für dieses Produkt ist groß.
nachher,,afterward; later,Ich rufe nachher nochmal an.
Nachhilfe,die,tutoring; extra help,Der Schüler braucht Nachhilfe in Mathematik.
Nachricht,die,message; news,Ich habe eine gute Nachricht für Sie. Sie haben die Prüfung bestanden.
nachschlagen,,to look up,Ich wiederhole heute 'nachschlagen'.
Nachspeise,die,dessert,Die Nachspeise ist ein nützliches Wort.
nächste,,next,Wo ist hier die nächste Apotheke?
Nachwuchs,der,young talent; offspring,Der Nachwuchs bei Forschern soll gefördert werden.
Nadel,die,needle,Hast du eine Nadel für mich? Ich muss einen Knopf annähen.
Nagel,der,nail,Kannst du mir den Nagel in die Wand schlagen?
Nähe,die,nearby; closeness,Die Post ist ganz in der Nähe vom Bahnhof.
nähen,,to sew,Meine Mutter näht ihre Kleider selbst.
genäht,,sewn; stitched,Wir müssen die Wunde nähen.
sich nähern,,to approach; to come closer,Ich übe das reflexive Verb 'nähern'.
Nahrungsmittel,das,food; foodstuff,Das Nahrungsmittel kommt in der Prüfung vor.
Familienname,der,family name; surname,Ludin ist mein Familienname.
Vorname,der,first name,Mein Vorname ist Thomas.
nämlich,,namely; because,Ich muss leider gehen. Ich habe nämlich noch einen Termin beim Zahnarzt.
Nase,die,nose,Haben Sie Nasentropfen? Ich bin stark erkältet.
nass,,wet,Es hat schrecklich geregnet. Ich bin ganz nass geworden.
national,,national,Das ist ein nationaler Wettbewerb.
natürlich,,of course; naturally,Natürlich helfen wir dir.
Nebel,der,fog,Wegen Nebels konnten wir gestern nicht in Frankfurt landen.
neben,,next to; beside,Neben mir ist noch ein Platz frei.
nebenan,,next door,"Das ist José, er wohnt nebenan."
nebenbei,,on the side; besides,Mein Freund studiert Geschichte. Und nebenbei arbeitet er in einer Kneipe.
Neffe,der,nephew,Meine Schwester hat zwei Kinder. Meine Neffen sind drei und fünf Jahre alt.
negativ,,negative,Du solltest nicht alles negativ sehen.
nehmen,,to take,Was möchten Sie? – Ich nehme einen Salat.
nein,,no,"Noch ein Bier? – Nein, danke."
nennen,,to call; to name,"Mein Freund heißt Alexander, aber alle nennen ihn Alex."
Nerv,der,nerve,Er leidet an einer Nervenkrankheit.
nervös,,nervous,Das Warten macht mich ganz nervös.
nett,,nice,Die Leute sind hier sehr nett.
Netz,das,net; mesh bag,Bitte bring ein Netz Orangen.
Netzwerk,das,network,Soziale Netzwerke sind wichtig.
neu,,new,Mein Wagen ist noch ganz neu.
Neuigkeit,die,news; update,In dieser Sache gibt es keine Neuigkeiten.
neugierig,,curious; nosy,Die Nachbarn sind ziemlich neugierig.
neulich,,recently,Ich war neulich bei der Bank und habe einen alten Freund getroffen.
nicht,,not,"Zigarette? Danke, ich rauche nicht."
Nichte,die,niece,Die Tasche ist ein Geschenk von meiner Nichte.
Nichtraucher,der,non-smoker,In unserer Familie sind alle Nichtraucher.
nichts,,nothing,Ich habe noch nichts gegessen.
nie,,never,Der Chef ist nie da.
niedrig,,low,Die Räume hier sind mir zu niedrig.
niemand,,nobody; no one,Ich habe geklingelt. Aber es war niemand zu Hause.
nirgends,,nowhere,Ich kann die Quittung nirgends finden.
nirgendwo,,nowhere,Die Schlüssel kann ich nirgendwo finden.
noch,,still; yet,Mein Bruder geht noch zur Schule.
noch mal,,again; once more,Vielen Dank nochmal.
nochmals,,again; once more,Nochmals vielen Dank!
normal,,normal,Fehler zu machen ist doch ganz normal.
normalerweise,,normally; usually,Wann haben Sie normalerweise Pause?
Notausgang,der,emergency exit,Der Notausgang ist gleich hier bei der Treppe.
Notfall,der,emergency,Wir haben einen Notfall. Bitte schicken Sie einen Krankenwagen. Im Notfall rufen Sie bitte diese Nummer an.
Notruf,der,emergency call,Der Notruf passt gut zu diesem Thema.
Note,die,grade; note,Eva hat immer sehr gute Noten in Mathematik.
notieren,,to note down,Ich habe mir den Termin notiert.
nötig,,necessary; needed,"Wenn es nötig ist, nehmen Sie noch eine Tablette."
Notiz,die,note,Ich habe Ihnen eine Notiz geschrieben.
notwendig,,necessary,"Muss ich nochmal wiederkommen? – Nein, das ist nicht notwendig."
Nudel,die,noodle; pasta,Möchten Sie Nudeln oder Reis? – Lieber Nudeln.
Nummer,die,number,Ich habe mich in der Hausnummer geirrt.
nun,,now; well,"Schade, dass du arbeiten musst. – Das ist nun mal so."
nur,,only; just,Im Kaufhaus gibt‘s T-Shirts für nur fünf Euro.
nutzen,,to use; to take advantage of,Ich möchte das schöne Wetter nutzen und spazieren gehen.
nützen,,to be useful; to benefit,Ich übe das Verb 'nützen'.
nützlich,,useful,Das Wort 'nützlich' ist nützlich.
ob,,whether; if,"Ich weiß noch nicht, ob ich kommen kann."
oben,,above; upstairs,Wir wohnen oben im Stock.
ober-,,upper,Die Wohnung im oberen Stockwerk ist vermietet.
Obers,das,cream; whipped cream,Ich hätte gern ein Stück Torte mit Schlagobers.
Obst/Früchte,das,fruit,Das Obst steht auf meiner Liste.
obwohl,,although,"Obwohl meine Kollegin krank ist, geht sie arbeiten."
oder,,or,Möchten Sie Kaffee oder Tee?
Ofen,der,oven; stove,Ich habe gerade eine Pizza gemacht. Sie ist ganz frisch aus dem Ofen.
offen,,open,Das Wort 'offen' ist im Alltag nützlich.
öffentlich,,public,In der Stadt fahre ich immer mit öffentlichen Verkehrsmitteln.
Öffentlichkeit,die,public; public sphere,Von solchen Dingen erfährt die Öffentlichkeit nur selten.
veröffentlichen,,to publish,Das Buch wurde gestern veröffentlicht.
offenbar,,apparently,Das Restaurant ist heute offenbar geschlossen.
offiziell,,official,Sie bekommen von uns eine offizielle Einladung.
öffnen,,to open,Wann öffnen die Geschäfte?
oft/öfter,,often; more often,Ich treffe mich oft mit meiner Freundin.
ohne,,without,Bitte eine Pizza ohne Zwiebeln.
Ohr,das,ear,Ich habe Ohrenschmerzen.
Öl,das,oil,Es fehlt Öl am Salat.
Oma,die,grandma,Meine Oma ist achtzig Jahre alt geworden.
Onkel,der,uncle,Nächste Woche fahre ich zu meinem Onkel nach Berlin.
Oper,die,opera,Die Oper ist ein nützliches Wort.
operieren,,to operate; to perform surgery,Wir müssen das Knie sofort operieren.
Operation,die,operation; surgery,Seit der Operation kann ich mein Knie nicht mehr bewegen.
Opfer,das,victim,Bei der Schiffskatastrophe gab es viele Opfer.
Orange,die,orange,Ich esse gern Orangen.
Orchester,das,orchestra,Auf unserer Hochzeit hat ein kleines Orchester gespielt.
Paar,das,couple; pair,Ina und Pedro sind ein Paar.
ordentlich,,neat; tidy,Mein Bruder ist ein sehr ordentlicher Mensch.
Ordination,die,doctor’s office; surgery,Die Ordination bleibt bis zum Jänner geschlossen.
ordnen,,to sort; to organize,Letztes Wochenende habe ich meine Papiere geordnet.
Ordner,der,folder; binder,Der Ordner steht im Regal.
organisieren,,to organize,Für den nächsten Sommerurlaub habe ich schon alles organisiert.
Organisation,die,organization,Die Organisation des Festes war sehr gut.
Original,das,original,Das Original ist für Sie. Wir bekommen die Kopie.
original,,original,Ich muss das originale Dokument abgeben.
Ort,der,place; town,Vergessen Sie Ort und Datum nicht.
Vorort,der,suburb,Mein Bruder wohnt in einem Vorort von Hamburg.
Wohnort,der,place of residence,Tragen Sie bitte auch Ihren Wohnort ein.
Ozean,der,ocean,Der Atlantik ist ein Ozean.
packen,,to pack,Ich muss noch meinen Koffer packen.
Paket,das,package; parcel,Hast du das Paket zur Post gebracht?
Panne,die,breakdown,Kurz vor München hatten wir eine Panne mit dem Auto.
Papier,das,paper,Hast du ein Blatt Papier für mich?
Matte,die,mat,Ich brauche eine Matte für den Sport.
parallel,,parallel,Die Goethestraße ist parallel zur Hauptstraße.
Parfüm,das,perfume,Zum Geburtstag habe ich von meinem Mann ein Parfüm bekommen.
Park,der,park,Ich gehe gern im Park spazieren.
parken,,to park,Hier dürfen Sie nicht parken.
geparkt,,parked,CH: Hier ist das Parken verboten.
parkieren,,to park,Hier dürfen Sie nicht parkieren.
Partner,der,partner,Wir haben das Geschäft zusammen. Wir sind Partner.
Party,die,party,Letzte Woche war ich auf einer Geburtstagsparty.
Pass,der,passport,Ich muss meinen Pass verlängern lassen.
Passagier,der,passenger,Der Passagier steht auf meiner Liste.
Passagierin,die,female passenger,Die Passagierin soll bitte zur Information kommen.
passen,,to fit; to suit,Der Pullover passt mir nicht mehr.
passieren,,to happen,Entschuldigung! – Kein Problem. Es ist nichts passiert.
passiv,,passive,Ich übe das Wort 'passiv'.
Patient,der,patient,Der Patient steht auf meiner Liste.
Patientin,die,female patient,Die Patientin möchte bitte einen Termin.
pauschal,,flat-rate; package,Sie haben die Reise pauschal gebucht.
Pause,die,break; pause,Wir machen zehn Minuten Pause.
Pech,das,bad luck,Es regnet. Unser Picknick fällt leider aus. – So ein Pech!
peinlich,,embarrassing,Das muss dir nicht peinlich sein.
Pension,die,guesthouse; pension,Im Urlaub haben wir in einer kleinen Pension gewohnt.
in Pension gehen/sein,,to retire; to be retired,Er ist in Pension gegangen.
pensioniert werden/sein,,to be retired; to retire,Ich werde Ende des Jahres pensioniert.
in Pension gehen/sein,,to retire; to be retired,Mein Nachbar ist seit zehn Jahren in Pension.
Pensionist,der,pensioner; retiree,Meine Großmutter arbeitet nicht mehr. Sie ist Pensionistin.
per,,by; via,Wie kann ich mich für den Kurs anmelden? – Per Fax oder E-Mail.
perfekt,,perfect,Die Reiseorganisation war perfekt.
Perron,der,platform,Auf Hauptbahnhöfen gibt es meist viele Perrons.
Person,die,person,Eintritt pro Person: 2 Euro.
persönlich,,personal; personally,Hier gibt es zu viele Autos. Das ist meine persönliche Meinung.
Personalien,die,personal details,Mein Kollege wird Ihre Personalien aufnehmen.
Personenstand/Familienstand,der,marital status; civil status,Der Personenstand ist ein nützliches Wort.
Personal,das,staff; personnel,Dieser Eingang ist nur für das Personal.
Pfanne,die,pan,Hast du keine größere Pfanne? Ich möchte Kartoffeln kochen.
Pfeffer,der,pepper,Bringen Sie uns bitte Pfeffer und Salz.
pflanzen,,to plant,Lass uns einen Baum pflanzen!
Pflanze,die,plant,"Wenn wir im Urlaub sind, gießt die Nachbarin unsere Pflanzen."
Pflaster,das,bandage; plaster,Das Pflaster passt gut zu diesem Thema.
pflegen,,to care for; to nurse,Meine Mutter ist sehr krank. Ich muss sie pflegen.
Pfleger,der,caregiver; male nurse,Der Pfleger steht auf meiner Liste.
Pflicht,die,duty; obligation,Als Autofahrer müssen Sie eine Versicherung haben. Das ist Pflicht.
Phantasie/Fantasie,die,imagination; fantasy,Mein Sohn malt sehr gut. Er hat viel Phantasie.
Picknick,das,picnic,Am Sonntag machen wir ein Picknick.
Pille,die,pill,Der Arzt hat mir neue Pillen verschrieben.
Pizza,die,pizza,Lass uns eine Pizza bestellen!
Plakat,das,poster,Im Unterricht haben wir ein Plakat gemacht.
planen,,to plan,"Wir haben geplant, diesmal im Urlaub nach Österreich zu fahren."
Plan,der,plan,"Was macht ihr im Sommer? – Ich weiß noch nicht, wir haben noch keine Pläne."
Planung,die,planning,Die Planung ist heute wichtig.
Plastik,das,plastic,Was für ein Spielzeug möchten Sie? Aus Plastik oder aus Holz?
Platz,der,space; place; seat,In unserer Wohnung haben wir nicht genug Platz.
plötzlich,,suddenly,Es war zuerst so schön. Plötzlich hat es angefangen zu regnen.
Politik,die,politics,Ich interessiere mich nicht für Politik.
Politiker,der,politician,"Weißt du, wie dieser Politiker heißt?"
politisch,,political,Ich diskutiere mit meinem Mann oft über politische Probleme.
Polizei,die,police,Rufen Sie bitte die Polizei.
Polizist,der,police officer,Der Polizist ist ein nützliches Wort.
Polizistin,die,female police officer,Die Polizistin hat den Verkehr geregelt.
Pommes frites,die,French fries,Die Kinder essen gern Würstchen mit Pommes frites.
populär,,popular,Diese Musik ist bei Jugendlichen populär.
Portemonnaie,das,wallet,Das Portemonnaie kommt in der Prüfung vor.
Portion,die,portion; serving,"Bitte, eine große Portion Sahne!"
positiv,,positive,Wir haben eine positive Nachricht für Sie. Sie bekommen die Stelle.
Post,die,post office; mail,Die Post macht erst um 8 Uhr auf.
Postleitzahl,die,postal code; zip code,Weißt du die Postleitzahl der Kollwitzstraße in Berlin?
Pöstler,der,mail carrier; postman,War der Pöstler schon da?
Poulet,das,chicken,D: Zum Mittagessen gibt es Poulet mit Reis.
Praktikum,das,internship,Ich mache diesen Sommer drei Monate ein Praktikum bei einer Firma.
Praktikant,der,intern,Der Praktikant ist heute wichtig.
Praktikantin,die,female intern,Sie hat als Praktikantin gearbeitet.
praktisch,,practical,Ich finde diese Küchenmaschine sehr praktisch.
präsentieren,,to present,Präsentieren Sie Ihre Ergebnisse bitte im Kurs.
Präsentation,die,presentation,Die Schülerin hat für ihre Präsentation eine gute Note bekommen.
Praxis,die,practice; medical practice,Das ist die Theorie. In der Praxis ist vieles ganz anders.
Preis,der,price; prize,Die Preise sind schon wieder gestiegen.
preiswert,,inexpensive; good value,'preiswert' kommt in vielen Texten vor.
Presse,die,press; media,Darüber konnte sich jeder in der Presse informieren.
prima,,great; excellent,Mit diesen Leuten verstehe ich mich prima.
privat,,private,Hier meine Nummer im Büro und meine private Nummer.
pro,,per; each,Eintritt pro Person: zwei Euro.
Problem,das,problem,José spricht nicht gern über seine Probleme.
produzieren,,to produce,Unsere Firma produziert Feuerzeuge.
Produkt,das,product,Unsere Produkte haben eine hohe Qualität.
Produktion,die,production,Die Produktion von Käse dauert oft viele Wochen.
Professor,der,professor,Der Professor steht auf meiner Liste.
Professorin,die,female professor,Die Professorin kommt in der Prüfung vor.
Profi,der,professional; pro,Der Profi ist ein nützliches Wort.
Profisportler,der,professional athlete,Mein Sohn möchte Profisportler werden.
Programm,das,program,Hast du schon ins Programm geguckt? Gibt es heute im Fernsehen einen schönen Film?
Projekt,das,project,Der Staat fördert Projekte für Kinder und Jugendliche.
Prospekt,der,brochure; prospectus,Bitte schicken Sie mir einen Prospekt von Ihrem Hotel.
Qualifikation,die,qualification,Für diese Arbeit haben Sie gute Qualifikationen.
Qualität,die,quality,"Für mich ist nicht nur der Preis wichtig, sondern auch die Qualität."
protestieren,,to protest,Wir protestieren gegen den Bau der Autobahn.
Protest,der,protest,Alle Proteste haben nichts genützt.
Prozess,der,trial; process,Der Prozess wird direkt aus dem Gerichtssaal im Fernsehen übertragen.
prüfen,,to examine; to test,'prüfen' kommt in vielen Texten vor.
geprüft,,checked; tested,Ich wiederhole heute 'geprüft'.
Prüfung,die,exam; test,Mein Freund hat die Prüfung bestanden.
Publikum,das,audience,Es war ein tolles Konzert. Das Publikum war begeistert.
Pullover,der,sweater; pullover,Der Pullover ist warm.
pünktlich,,punctual; on time,Seien Sie bitte pünktlich.
Puppe,die,doll,Unsere kleine Tochter bekommt zum Geburtstag eine Puppe.
putzen,,to clean,Ich muss heute noch die Wohnung putzen.
Quartier,das,neighborhood; quarter,Wir wohnen in einem schönen Quartier.
quer,,across; crosswise,Ich muss zu meiner Arbeit quer durch die ganze Stadt fahren.
Quittung,die,receipt,Brauchen Sie eine Quittung?
Quiz,das,quiz,Er hat beim Quiz gewonnen.
Rabatt,der,discount,Sie bekommen zehn Prozent Rabatt.
Rad,das,wheel; bicycle,Hast du noch ein Rad? Ich bin durch Glas gefahren und jetzt ist mein Rad kaputt.
Radfahrer,der,cyclist,Achtung! Da kommt eine Radfahrerin.
Radio,das,radio,Ich möchte mir ein neues Radio kaufen.
Rand,der,edge; outskirts,Wir wohnen am Rand der Innenstadt. Dort ist es billiger und ruhiger.
Rasen,der,lawn,Bitte den Rasen nicht betreten!
raten,,to advise; to guess,Ich möchte billig Urlaub machen. Was raten Sie mir?
Rat/Ratschlag,der,advice; council,Der Rat kommt in der Prüfung vor.
Rätsel,das,riddle; puzzle,Das Rätsel ist ein nützliches Wort.
rauchen,,to smoke,Hier ist das Rauchen verboten!
Raucher,der,smoker,Gibt es hier ein Zimmer für Raucher?
Raum,der,room; space,Getränke gibt es im Raum nebenan.
rauf,,up; upstairs,"Hier ist die Treppe, also los, schnell rauf!"
Reaktion,die,reaction,Diese Reaktion ist typisch für ihn.
realisieren,,to realize; to carry out,Diese Pläne sind nicht zu realisieren.
Realität,die,reality,Das gefällt dir nicht? Aber das ist die Realität.
realistisch,,realistic,"Ich glaube nicht, dass du für das Auto noch so viel Geld bekommst. Das ist nicht realistisch."
Recherche,die,research,Für diesen Bericht waren viele Recherchen nötig.
rechnen,,to calculate,Meine Tochter kann gut rechnen.
Rechner,der,calculator; computer,Für diese Aufgabe brauche ich einen Rechner.
Recht,das,law; right,Nach deutschem Recht kann er dafür nicht bestraft werden.
rechtlich,,legal,Wir beraten Sie in rechtlichen Fragen.
recht,,right; acceptable,"Ist es Ihnen recht, wenn ich morgen vorbeikomme?"
rechts,,right; on the right,An der nächsten Kreuzung müssen Sie rechts abbiegen.
rechtzeitig,,in time; timely,Bitte weck mich rechtzeitig. Ich muss pünktlich sein.
reden,,to talk,Worüber habt ihr gestern geredet?
Rede,die,speech,", -n Der Präsident hat eine Rede gehalten."
reduzieren,,to reduce,Wir haben jetzt unsere Preise reduziert.
Referat,das,presentation; report,Vielen Dank für dieses interessante Referat.
Reform,die,reform,Die Regierung plant für nächstes Jahr eine Reform. Die Steuern sollen steigen.
Regal,das,shelf,Das Buch steht im Regal oben rechts.
Regel,die,rule,Im Straßenverkehr sind viele Regeln zu beachten.
regelmäßig,,regular; regularly,Ich wiederhole heute 'regelmäßig'.
regeln,,to regulate; to arrange,Die Ampel ist kaputt. Ein Polizist regelt den Verkehr.
regnen,,to rain,Es hat gestern den ganzen Tag geregnet.
Regen,der,rain,Der Regen ist heute wichtig.
Region,die,region,In der Rhein-Main-Region sind die Mieten sehr hoch.
regional,,regional,'regional' kommt in vielen Texten vor.
reich,,rich,"Wenn ich reich wäre, würde ich eine Weltreise machen."
reichen,,to be enough; to reach,Ich nehme nur eine Suppe. Das reicht mir.
reif,,ripe; mature,Die Banane kannst du nicht essen. Sie ist noch nicht reif.
Reifen,der,tire,Der Reifen ist kaputt.
Reihenfolge,die,order; sequence,Achten Sie auf die Reihenfolge der Inhaltspunkte.
rein,,pure,Der Pullover ist aus reiner Wolle.
reinigen,,to clean,Ich möchte diesen Anzug reinigen lassen.
Reinigung,die,cleaning; dry cleaner,Die Reinigung des Büros ist nicht teuer.
Reis,der,rice,"Eine Portion Huhn mit Reis, bitte."
reisen,,to travel,Ich reise gern nach Spanien.
Reise,die,trip; journey,Wir haben eine Reise nach Österreich gebucht.
Reisebüro,das,travel agency,Wir haben die Reise im Reisebüro gebucht.
reiten,,to ride a horse,Möchtest du gerne reiten lernen?
Reklame,die,advertising; ad,Ich möchte keine Reklame im Briefkasten.
Rekord,der,record,Es gibt einen neuen Rekord im Schwimmen.
relativ,,relative; relatively,"Die Wohnung ist relativ groß, aber sehr teuer."
Religion,die,religion,Religion ist für manche Menschen sehr wichtig.
rennen,,to run,"Ich bin sehr schnell gerannt, aber der Bus war schon weg."
in Rente gehen/sein,,to retire; to be retired,Das Verb in Rente gehen ist wichtig.
Rentner,der,pensioner; retiree,Der Rentner kommt in der Prüfung vor.
reparieren,,to repair,Das Fahrrad kann man leider nicht mehr reparieren.
Reparatur,die,repair,Eine Reparatur wäre zu teuer.
Reportage,die,report; feature story,Die Reportage ist heute wichtig.
Reporter,der,reporter,Der Reporter steht auf meiner Liste.
reservieren,,to reserve,Ich wiederhole heute 'reservieren'.
Reservierung,die,reservation,Ich habe eine Reservierung für zwei Personen.
