word,article,english,example
Experte,der,expert,Ich verstehe ein bisschen was von Computern. Aber ich bin kein Experte.
Fabrik,die,factory,Ich arbeite in einer Autofabrik.
Fach,das,compartment; subject,Die Handtücher sind im obersten Fach links.
Export,der,export,"Hier ist die Firma Schulz, Import und Export."
Fachmann,der,expert; specialist,Der Fachmann ist heute wichtig.
Fachfrau,die,expert; specialist,Die Fachfrau steht auf meiner Liste.
extra,,extra; additional,Die Getränke kosten extra.
Fachleute,die,experts; specialists,Fachleute können Ihnen helfen.
Fähigkeit,die,ability; skill,"In seiner Position braucht man die Fähigkeit, andere zu überzeugen."
fahren,,to drive; to travel,Wir sind mit dem Zug gefahren.
gefahren,,driven; traveled,Fahr nicht so schnell. Frau Koch fährt einen Mercedes. Soll ich dich nach Hause fahren? Er hat das Auto in die Garage gefahren.
Fähre,die,ferry,Die Fähre kommt in der Prüfung vor.
extrem,,extreme; extremely,Die Prüfung war extrem schwer.
Fahrbahn,die,roadway; lane,Fahren Sie bitte vorsichtig. Es sind Kühe auf der Fahrbahn.
Fahrer,der,driver,Die Fahrerin des Wagens wurde nicht verletzt.
Fahrplan,der,timetable; schedule,Der Fahrplan hat sich geändert. Haben Sie schon den neuen Sommerfahrplan?
Fahrrad,das,bicycle,"D, A: Sie fährt jeden Morgen mit dem Fahrrad zur Arbeit."
Fahrzeug,das,vehicle,Wem gehört das Fahrzeug?
fair,,fair,"Ich finde, unsere Mannschaft hat sehr fair gespielt."
Faktor,der,factor,Die Creme hat einen hohen Sonnenschutzfaktor.
Fall,der,case; situation,Was würden Sie in diesem Fall tun?
fallen,,to fall,Das Glas ist auf den Boden gefallen.
fällig,,due,Die Rechnung ist Ende des Monats fällig.
falls,,if; in case,"Falls es regnet, machen wir kein Picknick."
falsch,,wrong; false,"Tut mir leid, ich habe die falsche Nummer gewählt."
Familie,die,family,Ich habe eine große Familie.
Familienstand/Personenstand,der,marital status; civil status,Der Familienstand kommt in der Prüfung vor.
fangen,,to catch,Das Kind hat den Ball gefangen.
Fantasie/Phantasie,die,imagination; fantasy,Mein Sohn malt sehr gut. Er hat viel Fantasie.
fantastisch,,fantastic,Ich übe das Wort 'fantastisch'.
Farbe,die,color,Welche Farbe magst du am liebsten?
farbig,,colored; colorful,Ich wiederhole heute 'farbig'.
Fasching,der,carnival,D: Dort hängt mein Kostüm für den Faschings(um)zug.
Fasnacht/Karneval,die,carnival,Die Fasnacht passt gut zu diesem Thema.
fassen,,to catch; to grasp,Sie haben den Dieb gefasst.
fast,,almost,Das Konzert ist fast zu Ende.
faul,,lazy,Mein Sohn war am Anfang in der Schule sehr faul. Heute lernt er sehr fleißig.
faulenzen,,to laze around,Am Wochenende können wir faulenzen.
fehlen,,to be missing; to lack,"1 Auf dem Brief fehlt der Absender. Hast du Kleingeld? Mir fehlt ein Euro. In der Kasse fehlen 20 Euro. Antonio war nicht in der Schule, er fehlt schon seit drei Tagen. Was fehlt Ihnen? Haben Sie Schmerzen?"
Fehler,der,mistake; error,"Ich glaube, da haben Sie einen Fehler gemacht."
Feier,die,celebration; party,Die Feier steht auf meiner Liste.
Feierabend,der,end of the workday,Der Feierabend kommt in der Prüfung vor.
Feiertag,der,public holiday,Der Feiertag ist ein nützliches Wort.
Feld,das,field,Auf diesem Feld wächst Gemüse.
Fenster,das,window,Das Fenster ist heute wichtig.
Ferien,die,vacation; holidays,Die Ferien beginnen im Juli.
fernsehen,,to watch TV,Meine Kinder dürfen abends nur eine Stunde fernsehen.
Fernsehen,das,television; TV,Was gibt es heute Abend im Fernsehen?
Fernseher,der,television set; TV,Der Fernseher ist kaputt.
fest,,firm; fixed; firmly,"Mein Kollege glaubt fest daran, dass er die neue Stelle bekommt."
Fest,das,festival; celebration,"Wenn ich 18 werde, feiern wir ein großes Fest."
Festplatte,die,hard drive,Mein Computer hat eine große Festplatte.
festhalten,,to hold on,Halt dich gut fest.
festlegen,,to decide; to commit oneself,"Ich weiß noch nicht, ob ich das mache. Ich möchte mich noch nicht festlegen."
festnehmen,,to arrest,Die Polizei hat einen Mann festgenommen.
festsetzen,,to set; to fix,Die Schule hat den Termin für die Prüfung festgesetzt.
feststehen,,to be fixed; to be certain,Der Termin steht seit Langem fest.
feststellen,,to determine; to notice,"Er hat festgestellt, dass der Absender des Briefes falsch war."
fett,,fatty; greasy,Die Wurst ist mir zu fett.
Fett,das,fat; grease,Das Fett ist heute wichtig.
feucht,,damp; moist,Die Wäsche ist noch feucht.
Feuer,das,fire,Der Schaden durch das Feuer war sehr groß.
Feuerzeug,das,lighter,Das Feuerzeug ist ein nützliches Wort.
Feuerwehr,die,fire department; fire brigade,Schnell! Rufen Sie die Feuerwehr!
Fieber,das,fever,Das Fieber ist heute wichtig.
Figur,die,figure; shape,Lars hat eine gute Figur.
Film,der,film; movie,Den Film musst du dir unbedingt ansehen.
finanzieren,,to finance,"Ich weiß nicht, wie ich das Auto finanzieren soll."
finanziell,,financial,Dieses Wort heißt 'finanziell'.
finden,,to find,Ich übe das Verb 'finden'.
gefunden,,found,gefunden. Ich kann meinen Schlüssel nicht finden. Luigi finde ich sehr nett.
Finger,der,finger,Alessandro hat sich in den Finger geschnitten. Seit wann arbeiten Sie bei dieser Firma?
flach,,flat,Für die Arbeit brauche ich flache Schuhe.
Fläche,die,area; surface,Unsere Wohnung hat eine Wohnfläche von 100 m².
Flasche,die,bottle,Wo kann man die leeren Flaschen zurückgeben?
Fleck,der,stain; spot,Du hast einen Fleck auf der Bluse.
Fleisch,das,meat,Fleisch mag ich nicht.
Fleischhauer,der,butcher,Der Fleischhauer ist ein nützliches Wort.
fleißig,,hard-working; diligent,Pamela ist wirklich fleißig. Sie macht immer ihre Hausaufgaben.
flexibel,,flexible,Meine Arbeitszeit ist flexibel.
fliegen,,to fly,Der Vogel ist auf einen Baum geflogen.
fliehen,,to flee,Der Einbrecher ist sofort geflohen.
Flucht,die,escape; flight,Der Einbrecher war schon auf der Flucht.
fließen,,to flow,Dieser Fluss fließt in die Nordsee.
geflossen,,flowed,Das Wort 'geflossen' ist im Alltag nützlich.
fließend,,fluent; flowing,Mein Kollege spricht fließend Deutsch.
Flohmarkt,der,flea market,Diesen Hut habe ich am Flohmarkt gekauft.
Flöte,die,flute,Sie spielt sehr schön Flöte.
Flug,der,flight,Ich habe den Flug für Sie gebucht.
Flughafen,der,airport,Der Flughafen liegt 30 km außerhalb der Stadt. Das Flugzeug ist gerade gelandet.
Flur,der,hallway; corridor,"D, CH:Wir warten draußen im Flur."
Fluss,der,river,Wie heißt dieser Fluss?
Flüssigkeit,die,liquid,Dieses Medikament mit viel Flüssigkeit einnehmen.
folgen,,to follow,Es folgen die Nachrichten.
Folge,die,consequence; episode,Die Folgen des Unfalls waren schlimm.
folgend,,following,Mehr Informationen auf den folgenden Seiten.
fordern,,to demand,Die Arbeitnehmer fordern mehr Geld.
Forderung,die,demand; claim,Alle Forderungen der Arbeitnehmer kann man in dieser E-Mail lesen.
fördern,,to support; to promote,Die Stadt fördert viele Sportprojekte.
Förderung,die,support; funding,Für das Projekt bekommen wir eine Förderung von der Stadt.
Form,die,form; shape,Diese Schuhe haben eine schöne Form.
Formular,das,form,Füllen Sie bitte dieses Formular aus.
Forschung,die,research,Er arbeitet in der Forschung.
Fortbildung,die,continuing education; professional training,"Die Fortbildung, die ich machen will, ist sehr teuer."
Fortschritt,der,progress,Ich habe beim Deutschlernen große Fortschritte gemacht.
fortsetzen,,to continue,Wir setzen die Behandlung am nächsten Donnerstag um 11 Uhr fort.
Fortsetzung,die,continuation,Fortsetzung folgt.
Forum,das,forum,Ich melde mich heute bei diesem Forum an.
fotografieren,,to photograph,Ich fotografiere gern.
Foto,das,photo,Können Sie dieses Foto vergrößern?
Fotoapparat,der,camera,Der Fotoapparat steht auf meiner Liste.
Fotograf,der,photographer,Der Fotograf hat sehr schöne Fotos gemacht.
Fotografie,die,photography,Fotografie ist ihr Hobby.
fragen,,to ask,Dieses Verb heißt 'fragen'.
Frage,die,question,Ich habe Ihre Frage leider nicht verstanden.
Frau,die,woman; Mrs.,Die Frau steht auf meiner Liste.
frech,,cheeky; rude,Du darfst in der Schule nicht so frech sein.
frei,,free; available,Ist dieser Platz noch frei?
im Freien,,outdoors; in the open air,Ich wiederhole heute 'im Freien'.
Freiheit,die,freedom,Die Freiheit ist heute wichtig.
Freizeit,die,free time; leisure time,Die Freizeit steht auf meiner Liste.
freiwillig,,voluntary; voluntarily,Manchmal bleibe ich freiwillig länger im Büro.
fremd,,foreign; strange,Ich reise gern in fremde Länder.
fressen,,to eat (animals),Hat der Hund schon etwas zu fressen bekommen?
sich freuen,,to be happy; to look forward to,"Es freut mich, dass alles so gut geklappt hat."
Freude,die,joy; pleasure,Diese Arbeit macht mir viel Freude.
Freund,der,friend,Ich sehe meine Freunde nur am Wochenende.
freundlich,,friendly,Er hat uns sehr freundlich begrüßt.
Freundschaft,die,friendship,Deine Freundschaft ist mir sehr wichtig.
Friede,der,peace,Wir wünschen uns Frieden.
frisch,,fresh,Das Brot ist noch ganz frisch.
Friseur,der,hairdresser,Du siehst toll aus! Wer ist dein Friseur?
Friseurin,die,female hairdresser,Meine Tochter will Friseurin werden.
Frisur,die,hairstyle,Du hast eine tolle Frisur! Warst du beim Friseur?
Frist,die,deadline; time limit,Die Frist für die Anmeldung zum Deutschkurs ist abgelaufen.
froh,,glad; happy,"Ich bin froh, dass alles so gut geklappt hat."
fröhlich,,cheerful; happy,Ich wiederhole heute 'fröhlich'.
Frucht,die,fruit,Welche Früchte kann man essen? Obst Früchte kaufe ich am liebsten auf dem Markt.
früh,,early,Hier ist schon am frühen Morgen starker Verkehr.
früher,,earlier; formerly,Früher habe ich in Berlin gewohnt.
Frühstück,das,breakfast,Das Frühstück steht auf meiner Liste.
fühlen,,to feel,"Wie fühlen Sie sich? Danke, ich fühle mich wohl."
führen,,to lead; to guide,Der Lehrer führt seine Schüler durch das Museum.
Führerausweis,der,driver’s license,Hast du einen Führerausweis?
Führerschein,der,driver’s license,Der Führerschein ist heute wichtig.
Führung,die,guided tour; leadership,Die Führung steht auf meiner Liste.
Fundbüro,das,lost and found office,Sie haben Ihren Schirm verloren. Da fragen Sie am besten im Fundbüro.
funktionieren,,to function; to work,'funktionieren' kommt in vielen Texten vor.
für,,for,Ist Post für mich da?
Gabel,die,fork,Wir brauchen bitte noch eine Gabel.
Galerie,die,gallery,Diese Galerie ist sehr interessant.
furchtbar,,terrible; awful,Dennis hat furchtbare Schmerzen.
Gang,der,hallway; course; gear,Der Gang ist ein nützliches Wort.
Fuß,der,foot,Er hat sich den linken Fuß gebrochen.
Fußball,der,soccer; football,Spielt ihr gerne Fußball?
ganz,,whole; entirely,Ich habe den ganzen Tag noch nichts gegessen.
Fußgänger,der,pedestrian,Dieser Weg ist nur für Fußgänger.
Fußgängerzone,die,pedestrian zone,Wir treffen uns um 15 Uhr in der Fußgängerzone.
füttern,,to feed,"Es ist im Zoo nicht erlaubt, die Tiere zu füttern."
gar,,done; cooked,Die Kartoffeln sind noch nicht gar.
Garage,die,garage,Hier ist eine Garage zu vermieten.
garantieren,,to guarantee,"Ich kann Ihnen nicht garantieren, dass das Gerät nächste Woche fertig ist."
Garantie,die,guarantee; warranty,Auf die Waschmaschine haben Sie ein Jahr Garantie.
Garderobe,die,cloakroom; wardrobe,Die Mäntel bitte an der Garderobe abgeben.
Garten,der,garden,Der Garten ist hinter dem Haus.
Gast,der,guest,Wir haben heute Abend Gäste.
Gasthaus,das,inn; pub,Gehen wir noch in ein Gasthaus ein Bier trinken?
Gaststätte,die,restaurant; pub,Ich arbeite seit einem Monat in einer Gaststätte.
Gebäude,das,building,Das Gebäude ist sehr alt.
Gebäck,das,pastry; baked goods,Das Gebäck ist ganz frisch.
Gebiet,das,area; region,In diesem Gebiet gibt es kaum Industrie.
Gebirge,das,mountains; mountain range,Wir haben unseren Urlaub im Gebirge verbracht.
geboren werden,,to be born,Wann und wo sind Sie geboren?
geboren,,born,Dieses Verb heißt 'geboren'.
gebrauchen,,to use; to need,Wir können diese Möbel gut gebrauchen.
Gebrauchsanweisung,die,instruction manual,Lesen Sie bitte zuerst die Gebrauchsanweisung.
Gebühr,die,fee; charge,Die Gebühr kommt in der Prüfung vor.
Geburt,die,birth,Wir gratulieren zur Geburt eures Kindes!
Geburtstag,der,birthday,Herzlichen Glückwunsch zum Geburtstag!
Gedicht,das,poem,Das Gedicht ist heute wichtig.
Geduld,die,patience,Die Geduld steht auf meiner Liste.
geehrt,,honored; dear,'geehrt' kommt in vielen Texten vor.
geeignet,,suitable,Dieses Spiel ist nicht für Kinder unter drei Jahren geeignet.
Gefahr,die,danger,Betreten der Baustelle auf eigene Gefahr.
gefährlich,,dangerous,"Achtung, hier ist eine gefährliche Kurve!"
gefallen,,to please; to like,Wie gefällt es Ihnen hier?
sich etwas gefallen lassen,,to put up with something,Das würde ich mir nicht gefallen lassen.
lassen,,to let; to leave,Dieses Wort heißt 'lassen'.
Gefängnis,das,prison,Er wurde zu fünf Jahren Gefängnis verurteilt.
Gefühl,das,feeling,"Ich glaube, ich schaffe die Prüfung. Ich habe ein gutes Gefühl."
gegen,,against; around; toward,Ich bin gegen einen Baum gefahren.
Gegner,der,opponent,Sie ist eine Gegnerin von Tierversuchen.
Gegensatz,der,contrast; opposite,Diese beiden Meinungen stehen in starkem Gegensatz zueinander.
Gegenstand,der,object; item,Ich schließe meine persönlichen Gegenstände im Schwimmbad lieber in ein Fach ein.
Gegenteil,das,opposite,Das Gegenteil von „klein“ ist „groß“.
gegenüber,,opposite; across from,Das Geschäft liegt direkt gegenüber der Post.
Gehalt,das,salary,Ich bin mit meinem Gehalt zufrieden.
Geheimnis,das,secret,Das kann ich dir nicht sagen. Das ist ein Geheimnis. geheim Das ist geheim. Du darfst es niemandem sagen.
geheim,,secret,Ich wiederhole heute 'geheim'.
gehen,,to go; to walk,Ich gehe jeden Morgen zu Fuß zur Arbeit.
gehören,,to belong,Gehört Ihnen das Haus?
Gehsteig/Trottoir,der,sidewalk; pavement,Der Gehsteig kommt in der Prüfung vor.
Geld,das,money,Ich habe nicht genug Geld dabei.
Geldautomat,der,ATM; cash machine,Der Geldautomat passt gut zu diesem Thema.
Gelegenheit,die,opportunity; occasion,"Das Fest ist eine gute Gelegenheit, unsere Freunde zu sehen."
gelingen,,to succeed,"Es ist mir gelungen, meinen Chef zu überzeugen."
gelten,,to be valid; to apply,Mein Pass gilt noch ein Jahr.
gemeinsam,,together; shared,Du musst die Wohnung renovieren? Ich helfe dir. Wir können das gemeinsam machen.
Gemeinschaft,die,community; common area,Rauchen ist in den Gemeinschaftsräumen nicht erlaubt.
Gemüse,das,vegetables,Wir kaufen das Gemüse direkt beim Bauern.
gemütlich,,cozy; comfortable,Wir haben eine sehr gemütliche Wohnung.
genau,,exact; precise,Haben Sie die genaue Zeit?
genauso,,exactly the same; just as,Katarina sieht genauso aus wie ihre Schwester.
genehmigen,,to approve,Mein Chef hat mir sechs Wochen Urlaub genehmigt.
Generation,die,generation,In diesem Haus wohnen drei Generationen zusammen.
genießen,,to enjoy,"Er kann das Essen leider nicht genießen, weil es zu scharf ist."
genug,,enough,Es ist noch genug Suppe da.
genügen,,to be enough; to suffice,Wie viele Zimmer brauchen Sie? – Mir genügt eine 2-Zimmer-Wohnung.
Gepäck,das,luggage; baggage,Ich habe mein Gepäck am Bahnhof gelassen.
gerade,,straight; just; right now,Das Bild hängt nicht gerade.
geradeaus,,straight ahead,Fahren Sie geradeaus bis zur nächsten Kreuzung.
Gerät,das,device; appliance,Ich kaufe meine Elektrogeräte immer gebraucht. Das ist viel billiger.
gerecht,,fair; just,Lass uns den Kuchen gerecht verteilen.
Gericht,das,court; dish,Ich habe heute Vormittag einen Termin beim Gericht.
gering,,low; small; slight,Unsere Mannschaft hatte nur eine geringe Chance.
gern/gerne,,gladly; like to,Ich helfe Ihnen gern.
gesamt-/Gesamt-,,total; entire; whole,Ich habe meine gesamten Bücher verschenkt.
geschehen,,to happen,Vielen Dank für Ihre Hilfe. – Gern geschehen.
Geschenk,das,gift; present,Vielen Dank für das Geschenk.
Geschichte,die,history; story,Ich interessiere mich nicht für Geschichte.
geschieden,,divorced,Ich bin seit drei Jahren geschieden.
Geschirr,das,dishes; tableware,Für die Geburtstagsfeier brauche ich Geschirr für zwölf Personen.
Geschlecht,das,sex; gender,Bitte kreuzen Sie an: „Geschlecht: weiblich/männlich“.
Geschmack,der,taste; flavor,Ich möchte bitte Kaugummi mit Erdbeergeschmack.
Geschwindigkeit,die,speed,Das Auto fuhr mit zu hoher Geschwindigkeit.
Geschwindigkeitsbeschränkung,die,speed limit,Bitte beachten Sie die Geschwindigkeitsbeschränkungen.
Geschwister,die,siblings,Die Geschwister sehen sich nur selten.
Gesellschaft,die,society; company,Er will die Gesellschaft verändern.
Gesetz,das,law,Das Parlament hat ein neues Gesetz beschlossen.
Gesicht,das,face,Wasch dir bitte das Gesicht.
gespannt,,excited; curious,"Ich bin gespannt, wer bei diesem Spiel gewinnt."
Gespräch,das,conversation; meeting,Herr Müller ist gerade in einem Gespräch.
gestern,,yesterday,Ich bin erst gestern zurückgekommen.
gesund,,healthy,Ich hatte Grippe. Jetzt bin ich wieder gesund.
Gesundheit,die,health,Sie müssen mehr auf Ihre Gesundheit achten.
Getränk,das,drink; beverage,Besorgst du bitte die Getränke?
Gewalt,die,violence,"Ich mag keine Filme, in denen Gewalt vorkommt."
Gewerkschaft,die,trade union,Die Gewerkschaft vertritt die Interessen der Arbeitnehmer.
Gewicht,das,weight,Wie teuer ist das Päckchen? – Das hängt vom Gewicht ab.
gewinnen,,to win,Ich möchte so gern einmal im Lotto gewinnen.
Gewinn,der,winnings; profit,Ich habe bei einem Ratespiel mitgemacht. Der Hauptgewinn ist ein Auto.
Gewissen,das,conscience,Ich habe deinen Geburtstag vergessen. Ich habe ein ganz schlechtes Gewissen.
Gewitter,das,thunderstorm,Gestern gab es ein starkes Gewitter.
gewöhnt/ist gewöhnt,,used to; accustomed to,"Ich bin daran gewöhnt, früh aufzustehen."
Gewohnheit,die,habit,"Er hat die Gewohnheit, morgens zuerst die Post zu erledigen."
gewohnt,,used to; accustomed,"Ich bin gewohnt, früh ins Bett zu gehen."
gewöhnlich,,usually; ordinary,Um die Zeit ist er gewöhnlich zu Hause.
Gewürz,das,spice,Von den scharfen Gewürzen bekommt man Durst.
gießen,,to water; to pour,Es hat nicht geregnet. Ich muss meine Blumen gießen.
Gift,das,poison,"Vorsicht, das Gift dieser Pflanze ist für Menschen gefährlich!"
giftig,,poisonous; toxic,Das Wort 'giftig' ist nützlich.
Gitarre,die,guitar,Ich spiele seit drei Jahren Gitarre.
Glace/Glacé,die/das,ice cream,Das Glacé schmeckt sehr gut.
Glas,das,glass,"Vorsicht, die Kanne ist aus Glas!"
glatt,,smooth; slippery,Fahr vorsichtig! Es ist glatt.
glauben,,to believe,"Ich glaube, der Chef ist heute nicht im Büro."
gleich,,same; soon; right away,'gleich' kommt in vielen Texten vor.
gleichfalls,,likewise; same to you,Dieses Wort heißt 'gleichfalls'.
gleichberechtigt,,equal; having equal rights,Ich wiederhole heute 'gleichberechtigt'.
gleichzeitig,,at the same time,Ich übe das Wort 'gleichzeitig'.
Gleis,das,track; platform track,Der Zug fährt heute von Gleis 7 ab.
Glück,das,luck; happiness,Du hast dich nicht verletzt. Da hast du Glück gehabt.
glücklich,,happy; lucky,'glücklich' kommt in vielen Texten vor.
Glückwunsch,der,congratulation,Herzlichen Glückwunsch zum Geburtstag!
Gold,das,gold,"Ist der Ring aus Gold? Nein, der sieht nur so aus."
Gott,der,God,Glaubst du an Gott?
Grafik,die,graphic; chart,Die Grafik zeigt die Temperaturen im letzten Jahr.
Gras,das,grass,Wir lagen den ganzen Tag im Gras.
gratulieren,,to congratulate,Ich gratuliere euch zur Geburt eurer Tochter.
Gratulation,die,congratulations,Herzliche Gratulation! Sie haben gewonnen!
gratis,,free of charge,"Diese Reparatur kostet Sie gar nichts, wir machen das gratis für Sie."
greifen,,to reach; to grab,Greifen Sie doch zu!
Grenze,die,border; limit,An der Grenze musst du deinen Ausweis zeigen.
grillen,,to grill; to barbecue,Heute wollen wir im Garten grillen.
grillieren,,to grill; to barbecue,Heute wollen wir im Garten grillieren.
Grill,der,grill; barbecue,Kannst du mir deinen Grill leihen? Wir wollen am Wochenende ein Picknick machen.
Grippe,die,flu,Ich habe eine Grippe und kann leider nicht kommen.
groß,,big; large; tall,Wir haben einen großen Garten.
gründen,,to found; to establish,Frau Bauer hat eine eigene Firma gegründet.
Grund,der,reason; ground,Sie haben Ihre Stelle gekündigt. Aus welchem Grund?
gründlich,,thorough,"Ich möchte die Wohnung gründlich reinigen, bevor der Besuch kommt."
Grundstück,das,plot of land; property,Wir wollen ein Haus bauen und suchen ein günstiges Grundstück.
Gruppe,die,group,Für Gruppen gibt es eine Ermäßigung.
grüßen,,to greet,"Wer war die Frau, die du eben gegrüßt hast?"
Gruß,der,greeting,Der Gruß ist heute wichtig.
gucken,,to look; to watch,Guck doch mal! Es schneit.
gültig,,valid,Mein Pass ist nur noch zwei Monate gültig.
Haar,das,hair,Meine Freundin hat langes schwarzes Haar.
günstig,,affordable; favorable,Ich suche eine günstige Ferienwohnung.
haben,,to have,Ich übe das Verb 'haben'.
gut,,good,Ich kenne ein gutes Lokal.
Gymnastik,die,gymnastics; exercise,Ich mache jeden Morgen Gymnastik.
Hackfleisch/Faschiertes,das,minced meat; ground meat,Das Hackfleisch ist ein nützliches Wort.
Hafen,der,harbor; port,"Wenn du in Hamburg bist, musst du dir unbedingt den Hafen ansehen."
Hähnchen/Hühnchen,das,chicken,Zum Mittagessen gibt es Hühnchen mit Reis.
halb,,half,Treffen wir uns um halb neun?
Halbpension,die,half board,Wir möchten ein Hotel mit Halbpension.
halbtags,,part-time,Ich habe ein kleines Kind und kann nicht acht Stunden am Tag arbeiten. Deshalb möchte ich halbtags arbeiten.
Hälfte,die,half,Bitte teilt euch die Schokolade. Jeder bekommt die Hälfte.
Halle,die,hall,Die Stadt baut eine neue Sporthalle.
Hallenbad,das,indoor swimming pool,Sie geht jeden Tag zum Schwimmen ins Hallenbad.
hallo,,hello,"Hallo, wie geht’s? − Danke, gut, und dir?"
Hals,der,throat; neck,Mir tut der Hals weh.
halt,,just; simply,Es gibt leider keine Karten mehr. – Schade. Da kann man nichts machen. Das ist halt so.
haltbar,,durable; good until,Diese Tomaten sind mindestens 2 Wochen haltbar.
halten,,to hold,Kannst du mal kurz meine Handtasche halten?
Halt,der,stop; support,Der Halt kommt in der Prüfung vor.
Haltestelle,die,stop; station,An der nächsten Haltestelle müssen wir aussteigen.
Hammer,der,hammer,Ich brauche einen Hammer.
Handwerker,der,craftsperson; tradesperson,Morgen sind bei uns die Handwerker. Wir bekommen eine neue Badewanne.
handeln,,to trade; to deal,Herr Huber hat ein kleines Geschäft. Er handelt mit Obst und Gemüse.
Handel,der,trade; commerce,Der Handel kommt in der Prüfung vor.
Händler,der,dealer; merchant,Der Händler ist ein nützliches Wort.
Handy,das,mobile phone; cell phone,"Ich habe kein Festnetztelefon, aber ein Handy."
hängen,,to hang,Das Bild hängt schief.
hart,,hard,Das Bett im Hotel war mir zu hart.
hassen,,to hate,Ich hasse Autofahren.
hässlich,,ugly,Das ist aber eine hässliche Lampe!
häufig,,often; frequent,Haben Sie häufig Kopfschmerzen?
Hauptbahnhof,der,main train station,Treffen wir uns am Hauptbahnhof?
Haus,das,house,Wir haben ein Haus gemietet.
Hausaufgabe,die,homework,Kannst du mir bei den Hausaufgaben helfen?
Hausfrau/Hausmann,die,housewife; househusband,Meine Frau ist Hausfrau und kümmert sich um die Kinder./Mein Mann ist Hausmann und kümmert sich um die Kinder.
Haushalt,der,household,"Ich kümmere mich um den Haushalt, d. h. ich putze, wasche, koche etc."
Hausmeister,der,caretaker; building manager,Der Hausmeister ist heute wichtig.
Haut,die,skin,Haben Sie eine Creme für trockene Haut?
heben,,to lift,Kannst du mir helfen? Das Paket kann ich allein nicht heben.
Heft,das,notebook,Ich hätte gern ein Schreibheft.
heim,,home,Ich will jetzt heim.
Heim,das,home; residence,Meine Oma wohnt in einem Seniorenheim.
Heimat,die,homeland; home,Ich lebe jetzt hier in Deutschland. Das ist meine neue Heimat.
heimlich,,secretly,"Gestern habe ich gehört, dass mein Sohn heimlich raucht."
Heimweh,das,homesickness,Ich habe oft Heimweh nach meiner Familie.
heiraten,,to marry,Unsere Freunde heiraten nächsten Monat in Italien.
heiß,,hot,Für die Jahreszeit ist es zu heiß.
heißen,,to be called; to mean,Das Verb 'heißen' ist wichtig.
heizen,,to heat,Wir heizen mit Öl.
Heizung,die,heating,Es ist kalt. Ist die Heizung kaputt?
Held,der,hero,Er spielt gern den Helden.
Heldin,die,heroine,Sie ist die Heldin des Tages.
helfen,,to help,Kannst du mir helfen? Ich muss nächsten Monat umziehen.
Hilfe,die,help,Die Hilfe kommt in der Prüfung vor.
hell,,bright; light,Im Sommer wird es um 5 Uhr schon hell.
Hemd,das,shirt,Nikos trägt heute ein weißes Hemd.
Hendl,das,chicken,D: Zum Mittagessen gibt es Hendl mit Reis.
her,,ago,"Wir haben uns lange nicht gesehen. – Ja, das ist wirklich lange her."
heraus,,out; outside,'heraus' kommt in vielen Texten vor.
Herausforderung,die,challenge,Das Spiel ist eine Herausforderung.
Herd,der,stove; cooker,In der neuen Küche fehlt noch der Herd.
herein,,in; come in,Kommt doch herein!
Herr,der,gentleman; Mr.,"Da ist ein Herr, der möchte Sie sprechen."
herstellen,,to manufacture; to produce,In unserer Firma stellen wir Schokolade her.
Hersteller,der,manufacturer,Der Hersteller ist ein nützliches Wort.
herunter,,down; downward,Ich wiederhole heute 'herunter'.
Herz,das,heart,Ich bin ganz nervös. Mir klopft das Herz.
herzlich,,heartfelt; cordial,Herzlichen Glückwunsch!
heute,,today,Heute kann ich etwas früher nach Hause gehen.
heutig/hier,,today’s; here,Dieses Wort heißt heutig.
Himmel,der,sky; heaven,Wir hatten im Urlaub so tolles Wetter. Immer Sonne und blauer Himmel.
hinten,,at the back; behind,Wo möchtest du sitzen? Hinten oder vorne?
hinter,,behind,Hinter dem Haus haben wir einen Garten.
